label,id,date,channel_id,message,views,image
3,1038,2024-09-06 17:30:27+00:00,1509614260,"Pump Result : Congratulations on the profits ! PEL reached a high of 211 % after our signal ( on both Kucoin_CEX and MEXC_CEX ) , giving all our members multiple opportunities to book huge gains . Even though the percentage gain wasn't what we expected due to BTC dumping and bearish market conditions , we saw that our market dominance is stronger than ever , and we're ready for something bigger … We've planning something bigger than anything seen before , and as always our members will be the fist ones to know . If everything is executed as expected , profits will be unimaginable . Stay tuned",21615,
5,1037,2024-09-06 16:07:01+00:00,1509614260,"Price is holding up extremely well with massive volume , be ready to go even higher !",20739,
5,1036,2024-09-06 16:06:06+00:00,1509614260,3rd wave incoming ! ! FOMO buyers about to come in !,20235,
5,1035,2024-09-06 16:06:06+00:00,1509614260,Buy he dip and hold for maximum profits !,19864,
5,1034,2024-09-06 16:04:02+00:00,1509614260,We're about to go much higher ! !,19531,
5,1033,2024-09-06 16:03:02+00:00,1509614260,Outside traders buying in !,19147,
5,1032,2024-09-06 16:02:02+00:00,1509614260,Twitter will get the signal in 60 seconds ! !,18812,
5,1031,2024-09-06 16:01:33+00:00,1509614260,The target is 700 % !,18449,
2,1030,2024-09-06 16:00:18+00:00,1509614260,The Coin We Are Pumping Today is : PEL Buy and hold for massive profits — — — KUCOIN_CEX : EXCHANGE: kucoin_CEX; TRADING PAIR: PEL-USDT. MEXC_CEX : EXCHANGE: mexc_CEX; TRADING PAIR: PEL-USDT. — — —,19116,
1,1029,2024-09-06 15:56:08+00:00,1509614260,"5 minutes left , the next message will be the coin to buy !",16468,
1,1028,2024-09-06 15:51:24+00:00,1509614260,10 minutes left .,16358,
1,1027,2024-09-06 15:31:40+00:00,1509614260,"30 minutes left . This pump will be executed in 3 different waves , the first one will be the signal sent here , and the other 2 will be signals sent afterwards to other social media channels . This is expected to be our strongest pump yet . You will receive the signal before anyone else , and remember , the strategy to score the biggest profits is to buy and hold , don't sell below our target !",16383,
1,1025,2024-09-06 15:01:46+00:00,1509614260,"1 hour remaining for our ULTRA PUMP ! ! We're ready for a massive pump . Volume will be huge , and our whales will be constantly buying and pushing towards new highs , making sure everyone can take the highest profits . We're ready for an easy 700 % , so make sure to hold after market buying , as the second and third waves are always the strongest ( which could reach even higher than 1,000 % ) . Expect an extremely powerful and long lasting pump today ! IMPORTANT : This coin will ONLY be available on KUCOIN_CEX and MEXC_CEX on USDT pair , get ready for huge profits !",12461,
1,1024,2024-09-06 13:01:09+00:00,1509614260,"3 hours left until the ULTRA PUMP ( Kucoin_CEX and MEXC_CEX ) . This is a basic step-by-step strategy for new members : 1 . Ten minutes before 16:00 PM GMT have kucoin_CEX / MEXC_CEX , Telegram open . 2 . At exactly 16:00 PM GMT , there will a message including the name of our coin in our Telegram channel . 3 . After the announcement , you already know what to do ( review our guide and tips ) .",14242,
1,1022,2024-09-06 10:00:22+00:00,1509614260,"6 hours left ! ! IMPORTANT TIPS : - Our target will be very high profit today ( Aiming at a minimum 700 % ) . We will be using the KUCOIN_CEX and MEXC_CEX to pump . - We will be using the USDT pairing to buy , make sure you have USDT in your account to buy the coin . - Hundreds of thousands of traders will be buying at once , make sure you buy early before outsiders do . - If you plan to use your whole balance , you can buy using 75 % of your balance initially at market price , use the remaining of your balance to place buy orders ! - When you buy the coin and it's time to sell , never sell on the buy supports ! Instead sell slowly in parts as the price goes up . - Our pump will have many waves as our whales will actively be buying with our members to support the price , there will be a lot of possibilities to make profits many times during the pump ! - After buying , we highly suggest to place buy orders below the market price as the price moves up . - Millions of traders worldwide will be watching and buying , we have put into place a few measures to spread the word out after our signal all over social media , we will make sure our pump lasts and holds as long as possible , as always .",9373,
1,1021,2024-09-06 04:01:06+00:00,1509614260,"12 Hours Left ! For our ULTRA PUMP . The coin will only be available on KUCOIN_CEX and MEXC_CEX , so have USDT in either ready to participate . The biggest crypto communities and groups will participate in this pump … something never seen before and the reason why our target is at least 700 % . We've onboarded all the biggest whales in the market , and we'll make sure there is absolutely no pre-buying and no pre-pump . Make sure to read our VIP guide on how to score the biggest profit : UNKNOWN_URL: telegra",8298,
0,1019,2024-09-05 16:00:19+00:00,1509614260,"🛎 Pump Signal Announcement ! 🛎 Date : FRIDAY September 6 , 2024 Time : 16:00 pm GMT Exchange : KUCOIN_CEX and MEXC_CEX Advantage : Free for all With the massive success of our previous pumps ( reaching peak targets of 800-1500 % , and averaging volumes of tens of millions of $ ) , with a team stronger than ever and with the market ready to explode , we're ready to announce our next ULTRA PUMP ( KUCOIN_CEX and MEXC_CEX ) . This pump will be the strongest we've had by all standards . Over 1 million new traders will be joining this pump , expecting a target of no less than 700 % . We're being conservative with this target , as our sheer strength will likely take us higher , guaranteeing our members the first entries , and the biggest profits … Our main goal for this pump will be to bring in the most outside traders , which will push us to our 700 % target and higher . Our elite team of whales will be supporting the pump long after our signal , making it a constant and long lasting pump . We have exactly 24 hours to prepare for this ULTRA PUMP ( KUCOIN_CEX and MEXC_CEX ) , which will take place on FRIDAY September 6 , at 16:00 GMT . Millions of traders will participate worldwide , and our social media militia will make sure there is no shortage of fomo buyers for our members to take profits . 700 % is the minimum target . Turn on channel notifications and stay tuned 🐋",6658,
3,878,2024-05-03 19:56:55+00:00,1509614260,"Pump Results : Even with the market bearish and a much lower volume than expected , we managed to pump $ VERSE to an impressive high of 457 % , which kept printing higher highs over several minutes , giving our members multiple opportunities to book huge profits . We expect the market to be back to normal soon , and our next pump to be truly massive by every standard . We're preparing the biggest marketing campaign we've ever had , which should bring over half a million new traders to our community , and with the market slowly but surely turning bullish again , we expect to see a never seen before breed of pumps very soon , which will outperform any pump seen so far , and will guarantee our members bigger profits than ever before . Stay tuned for our next pump announcement ! !",7645,
5,877,2024-05-03 17:06:00+00:00,1509614260,We're going higher ! !,6170,
5,876,2024-05-03 17:05:00+00:00,1509614260,"Our next wave is starting , price is holding up extremely well with massive volume , be ready to go even higher !",6177,
5,875,2024-05-03 17:04:01+00:00,1509614260,3rd wave incoming ! ! Buy he dip and hold this gem for maximum profits ! !,6184,
5,874,2024-05-03 17:03:00+00:00,1509614260,"Do not sell , we're about to go much higher ! !",6245,
5,873,2024-05-03 17:02:22+00:00,1509614260,"2nd wave starting now , buying every small dip before reaching new highs ! !",6331,
5,872,2024-05-03 17:02:00+00:00,1509614260,Outside traders coming in ! ! !,6377,
2,871,2024-05-03 17:01:01+00:00,1509614260,The Coin We Are Pumping Today is : VERSE Buy and hold for massive profits EXCHANGE: kucoin_CEX; TRADING PAIR: VERSE-USDT.,7305,
2,870,2024-05-03 17:00:06+00:00,1509614260,The Coin We Are Pumping Today is : VERSE Buy and hold for massive profits EXCHANGE: kucoin_CEX; TRADING PAIR: VERSE-USDT.,6797,
1,869,2024-05-03 16:59:00+00:00,1509614260,"1 minute left , the next message will be the coin to buy !",5556,
1,868,2024-05-03 16:55:01+00:00,1509614260,"5 minutes left . We have twitter and all other social media platforms ready to explode after our signal , keep your screens open ! Our whales are ready and active ! ! Minimum target is 1,000 % .",5723,
1,867,2024-05-03 16:50:01+00:00,1509614260,10 minutes left .,5153,
1,866,2024-05-03 16:30:01+00:00,1509614260,"30 minutes left . This pump will be executed in 3 different waves , the first one will be the signal sent here , and the other 2 will be signals sent afterwards to other social media channels . This pump will most likely be the strongest we've had , easily reaching above 1,000 % . You will receive the signal before anyone else , and remember , the strategy to score the biggest profits is to buy and hold ! !",5233,
1,864,2024-05-03 16:00:01+00:00,1509614260,"1 hour remaining for our biggest Kucoin_CEX Mega Pump ! ! The whole market is ready for another leg up , and in the perfect position for a massive pump ! ! We expect the biggest volume yet , as all our whales will be constantly buying and pushing towards new highs . We're ready for an EASY 1,000 % move ( at least ) , guaranteeing the maximum profits for all our members . Make sure to hold after market buying , as the second and third waves are always the strongest ( which could reach even higher than 1,000 % ) . Expect an extremely powerful and long lasting pump today , be prepared ! IMPORTANT : This coin will ONLY be available on KUCOIN_CEX and on USDT pair , get ready for huge profits !",4433,
1,863,2024-05-03 14:00:02+00:00,1509614260,"3 hours left until the Kucoin_CEX Mega Pump . This is a basic stepbystep-strategy for new members : 1 . Ten minutes before 17:00 PM GMT have Kucoin_CEX , Telegram open . 2 . At exactly 17:00 PM GMT , there will a message including the name of our coin in our Telegram channel . 3 . After the announcement , you already know what to do ( review our guide and tips ) .",4256,
1,862,2024-05-03 11:00:01+00:00,1509614260,"6 hours left ! ! IMPORTANT TIPS : - Our target will be very high profit today ( Aiming at a minimum 1,000 % ) . We will be using the Kucoin_CEX exchange to pump . - We will be using the USDT pairing to buy , make sure you have USDT in your account to buy the coin . - Hundreds of thousands of traders will be buying at once , make sure you buy early before outsiders do . - If you plan to use your whole balance , you can buy using 75 % of your balance initially at market price , use the remaining of your balance to place buy orders ! - When you buy the coin and it's time to sell , never sell on the buy supports ! Instead sell slowly in parts as the price goes up . - Our pump will have many waves as our whales will actively be buying with our members to support the price , there will be a lot of possibilities to make profits many times during the pump ! - After buying , we highly suggest to place buy orders below the market price as the price moves up . - Millions of traders worldwide will be watching and buying , we have put into place a few measures to spread the word out after our signal all over social media , we will make sure our pump lasts and holds as long as possible , as always .",3961,
1,861,2024-05-03 05:00:01+00:00,1509614260,"12 Hours Left ! ! This pump will be one of a kind , and for a good reason … the meticulous preparation of our team combined with the perfect market conditions are a phenomenon that will make this pump perfect . Expect no less than 1,000 %",3449,
3,859,2024-05-02 17:18:01+00:00,1509614260,"Just an example of a previous pump ( $ BONDLY ) which reached a high of over 800 % in the first 30 minutes and totaled $ 10 Million in Volume . It remained the Top 1 gainer on Kucoin_CEX for over 24 hours , scoring huge profits for all our members . With a community stronger than ever , and the biggest whales in the market on our side , we can expect tomorrow's pump to be at least 2x as strong . We will show our real power in this pump , and 1,000 % is our first target , so hold on tight …",4062,
1,858,2024-05-02 17:02:00+00:00,1509614260,"24 hours left for our Kucoin_CEX Mega Pump ! ! With never seen before marketing strategies , our growth over the past month will guarantee the maximum number of participants and the biggest volume in this pump , reaching millions of traders from every corner of the world , and a volume of several million $ in the first hour . We'll be constantly pushing the price higher , not likely seeing many retracements . Buying and holding as soon as the signal is announced will be the most profitable strategy . Our goal in this pump is to guarantee all our members profits of at least 1,000 % You've already seen what we are capable of achieving , and it's not even close to what we expect tomorrow . Get ready for not only our biggest pump of the year , but our biggest pump in history !",3634,
1,856,2024-04-30 17:00:01+00:00,1509614260,"3 days left ! ! For what will officially be the biggest Kucoin_CEX Mega Pump we've ever had . All the biggest crypto communities and channels will be participating in this pump … something never seen before and potentially a once in a lifetime event ! To guarantee the biggest profits for all our members ( at least 1,000 % ) , we've onboarded all the biggest whales in the market , and we'll make sure there is absolutely no pre-buying and no pre-pump . Make sure to read our VIP guide on how to make the most profits from this Kucoin_CEX Mega Pump : UNKNOWN_URL: telegra",4938,
1,855,2024-04-28 17:00:01+00:00,1509614260,"5 days left ! ! 1,000 % move expected as a minimum . This will be the biggest pump we've EVER had , at least 2x the size of any previous pump .",5307,
0,852,2024-04-26 17:12:26+00:00,1509614260,"🛎 Pump Signal Announcement ! 🛎 Date : FRIDAY May 3 , 2024 Time : 17:00 pm GMT Exchange : KUCOIN_CEX Advantage : Free for all With the massive success of our previous pumps ( reaching peak targets of 800-1500 % , and averaging volumes of tens of millions of $ ) , which made huge profits for all our members , with a team stronger than ever and with the market ready to explode to new all time highs , we're ready to announce our next KUCOIN_CEX Mega Pump , which will be by all standards the strongest we've ever had ! We've been meticulously planning this pump … we've 2x our massive and global marketing campaign , which means we're going to see over 500,000 new traders ( and the biggest whales ) joining this pump . We expect it to reach a high of no less than 1,000 % . This is a minimum , as our sheer strength could take this pump to a peak of well over 1,200 % . This KUCOIN_CEX Mega Pump will have the largest volume ever recorded ( at least twice the volume of any other previous pumps ) , this means that all our members will be guaranteed the first entries , and the biggest profits … Our main goal for this pump will be to once again bring the most outside traders into our pump , which will push us up to our 1,000 % target and higher . Our elite team of whales will be supporting the pump for hours after our signal , which will guarantee the biggest profits for all our members . We have exactly 7 days to prepare for this massive pump , which will take place on FRIDAY May 3 , at 17:00 GMT . We expect millions of traders worldwide to participate in this pump , and we will make all social media platforms explode after our signal , which will get us to our 800 % target ( and very likely higher ) . Be ready for further announcements and don't forget to turn on push notifications for our channel ! !",6914,
3,736,2024-02-23 19:50:42+00:00,1509614260,"Pump Result : We promised , and we delivered . Extraordinary pump with over $ 3.3 million in trading volume in the first hour , which confidently pushed $ FEAR to a high of 757 % at its peak , and made it the Top 1 Gainer on Kucoin_CEX for hours , holding above 180 % even hours after our signal . As seen in the shape of the chart , there was plenty of sustained growth with amole time to buy low and sell high . Even though we didn't reach our 1,000 % + target , it was more than enough for all our members to make huge profits throughout several impulse waves . We're still receiving a flood of gratitude messages from all the members who made it big , and even though this was a “ decent ” pump , we're not here for just “ decent ” and rest assured we'll 10x our efforts for the next one , which will easily break above 1,000 % , just as we saw in other pumps ( such as $ MXC , which reached a peak of 1,007 % ) . We know you're all eager about our next Kucoin_CEX Mega Pump . No stress , enjoy the profits … we'll let you know sooner than you expect . In the meantime , we're focusing our efforts on never used before marketing strategies to bring in over 1 million new members for our next Kucoin_CEX Mega Pump , which will absolutely dwarf anything we've seen until now . Stay tuned for our next pump announcement .",22636,
5,735,2024-02-23 17:06:20+00:00,1509614260,We're going higher ! !,15952,
5,734,2024-02-23 17:05:38+00:00,1509614260,"Our next wave is starting , price is holding up extremely well with massive volume , be ready to go even higher !",16352,
5,733,2024-02-23 17:04:20+00:00,1509614260,3rd wave incoming ! ! Buy he dip and hold this gem for maximum profits ! !,16551,
5,732,2024-02-23 17:03:20+00:00,1509614260,"Do not sell , we're about to go much higher ! !",18596,
5,731,2024-02-23 17:02:20+00:00,1509614260,"2nd wave starting now , buying every small dip before reaching new highs ! !",22163,
5,730,2024-02-23 17:01:20+00:00,1509614260,"The target is 1,400 % ! !",17204,
2,729,2024-02-23 17:00:14+00:00,1509614260,The coin we are pumping today is : FEAR Buy and hold for massive profits EXCHANGE: kucoin_CEX; TRADING PAIR: FEAR-USDT.,21244,
1,728,2024-02-23 16:59:00+00:00,1509614260,"1 minute left , the next message will be the coin to buy !",20328,
1,727,2024-02-23 16:55:00+00:00,1509614260,"5 minutes left . We have twitter and all other social media platforms ready to explode after our signal , keep your screens open ! Our whales are ready and active ! !",21965,
1,726,2024-02-23 16:50:00+00:00,1509614260,"10 minutes left . Millions of outside traders around the world will keep buying and pushing the price higher , we'll be holding to our 1,400 % + target",14679,
1,724,2024-02-23 16:30:01+00:00,1509614260,"30 minutes left . This pump will be executed in 3 different waves , the first one will be the signal sent here , and the other 2 will be signals sent afterwards to other social media channels . This pump will most likely be the strongest we've had , easily reaching above 1,400 % . You will receive the signal before anyone else , and remember , the ay to make the biggest profits is to buy and hold ! !",18398,
1,723,2024-02-23 16:00:00+00:00,1509614260,"1 hour remaining for our biggest Kucoin_CEX Mega Pump ! ! BTC pumping hard , making the market extremely bullish . We expect the biggest volume yet , as all our whales will be constantly buying and pushing towards new highs . We're ready for an EASY 1,400 - 1,700 % move ( at least ) , guaranteeing the maximum profits for all our members . Make sure to hold after market buying , as the second and third waves are always the strongest ( which could reach up to 1,700 % or higher ) . Expect an extremely powerful and long lasting pump today , be prepared ! IMPORTANT : This coin will ONLY be available on KUCOIN_CEX and on USDT pair , get ready for huge profits !",16252,
1,722,2024-02-23 14:00:00+00:00,1509614260,"3 hours left until the Kucoin_CEX Mega Pump . This is a basic step-by-step-strategy for new members : 1 . Ten minutes before 17:00 PM GMT have Kucoin_CEX , Telegram open . 2 . At exactly 17:00 PM GMT , there will a message including the name of our coin in our Telegram channel . 3 . After the announcement , you already know what to do ( review our guide and tips ) .",12869,
1,721,2024-02-23 11:00:00+00:00,1509614260,"6 hours left ! ! IMPORTANT TIPS : - Our target will be very high profit today ( Aiming at a minimum 1,400 % -1,700 % ) . We will be using the Kucoin_CEX exchange to pump . - We will be using the USDT pairing to buy , make sure you have USDT in your account to buy the coin . - Hundreds of thousands of traders will be buying at once , make sure you buy early before outsiders do . - If you plan to use your whole balance , you can buy using 75 % of your balance initially at market price , use the remaining of your balance to place buy orders ! - When you buy the coin and it's time to sell , never sell on the buy supports ! Instead sell slowly in parts as the price goes up . - Our pump will have many waves as our whales will actively be buying with our members to support the price , there will be a lot of possibilities to make profits many times during the pump ! - After buying , we highly suggest to place buy orders below the market price as the price moves up . - Millions of traders worldwide will be watching and buying , we have put into place a few measures to spread the word out after our signal all over social media , we will make sure our pump lasts and holds as long as possible , as always .",12598,
1,720,2024-02-23 05:00:01+00:00,1509614260,"12 Hours Left ! ! This is the first pump of the month , and for a good reason … we've been preparing for it meticulously , and expect no less than 15x ( 1,400 % )",12217,
3,717,2024-02-22 17:15:00+00:00,1509614260,"Here is our last pump result , reaching a high of 593 % in the first 30 minutes and racking $ 1.89 Million in total Volume , which made it the Top 1 gainer on Kucoin_CEX for hours and scored huge profits for all our members . With the market stronger than ever , the biggest whales in our team and millions of new traders ready , we expect tomorrow's signal to be at least 3x as strong . The real power of the strongest whales in the market will be seen in this pump , and it will break above 1,400 % , so hold on tight .",14727,
1,716,2024-02-22 17:00:00+00:00,1509614260,"24 hours left for our Kucoin_CEX Mega Pump ! ! Our marketing efforts over the past month will guarantee the maximum number of participants and the biggest volume in this pump , reaching millions of traders from every corner of the world , and a volume of tens of millions of $ in the first hours . We'll be constantly pushing the price higher , not likely seeing many retracements , prompting exponential growth . Buying and holding as soon as the signal is announced will be the most profitable strategy . Our goal in this pump is to guarantee all our members the biggest profits possible , aiming at a minimum of 1,400 % + We've had several weeks to grow our community to a size never seen before , and tomorrow's pump will be a clear display this . We fully expect it to be the most powerful pump we have ever done !",12344,
1,715,2024-02-21 17:00:00+00:00,1509614260,"2 days left ! ! Exactly 48 hours left for the biggest Kucoin_CEX Mega Pump we've ever seen ! ! Our goal is for all our members to make huge profits from this pump , our goal is a minimum of 1,400 % ( and like reaching much higher than 1,700 % with the power of our whales )",19029,
1,714,2024-02-20 17:00:00+00:00,1509614260,"3 days left for our massive Kucoin_CEX Mega Pump . We've chosen FRIDAY February 23 because market conditions are perfect and we're ready to make all our members profits of at least 1,400 % ( which is the bare minimum and will likely explode even higher ) . To guarantee this , we have the biggest whales in the market onboard this pump with us , and we'll make sure there is absolutely no pre-buying and no pre-pump . Make sure to read our VIP guide on how to make the most profits from this Kucoin_CEX Mega Pump : UNKNOWN_URL: telegra",13721,
1,713,2024-02-19 17:00:00+00:00,1509614260,4 days left ! !,14997,
1,712,2024-02-16 17:00:00+00:00,1509614260,7 days left ! ! Exactly 1 week left for the biggest and highest volume pump we've EVER had !,14688,
