label,id,date,channel_id,message,views,image
0,710,2024-02-10 18:00:00+00:00,1509614260,"🛎 Pump Signal Announcement ! 🛎 Date : FRIDAY February 23 , 2024 Time : 17:00 pm GMT Exchange : KUCOIN_CEX Advantage : Free for all With the massive success of our previous pumps ( reaching peaks of 800-1500 % , and averaging volumes of tens of millions of $ ) , which made huge profit for all our members , with a team stronger than ever and with the Bull Market at its prime , we're ready to announce our next KUCOIN_CEX Mega Pump , which will be by all standards the strongest we've ever had ! We've been meticulously planning this pump for months behind the scenes and we've put together a massive and global marketing campaign , which means we're going to see over a million new traders ( and the biggest whales ) joining this pump . We expect it to reach a high of no less than 1,200 % . This is a minimum , as the bull market could take this pump to a peak of well over 1,700- 1,900 % . This KUCOIN_CEX Mega Pump will have the largest volume ever recorded ( at least twice the volume of any other previous pump ) , this means that all our members will be guaranteed the first entries , and the biggest profits … Our main goal for this pump will be to once again bring the most outside traders into our pump , which will push us up to our 1,200 % target and higher . Our elite team of whales will be supporting the pump for hours after our signal , which will guarantee the biggest profits for all our members . We have exactly 13 days to prepare for this massive pump , which will take place on FRIDAY February 23 , at 17:00 GMT . We expect millions of traders worldwide to participate in this pump , and we will make all social media platforms explode after our signal , which will get us to our 1,200 % target ( and very likely higher ) . Be ready for further announcements and don't forget to turn on push notifications for our channel ! !",23240,
3,383,2023-05-30 15:39:19+00:00,1509614260,"PEL reached a 498 % high after our signal , making huge profits for all our members , and regardless of the unexpected selling pressure we saw in the first few minutes ( likely coming from team holdings ) , our whales managed to once again push us higher on a second and third wave , each over making an extra 150 % or more . This gave hundreds of our members multiple opportunities to make big profits , and held PEL as Kucoin_CEX's 1 top gainer for over 24 hours , just as we told you . We've received multiple appreciation messages from our members , who managed to 4x or 5x their investment , and even though this was a decent pump , we're planning something even bigger … stay tunned",29904,
3,381,2023-05-28 18:13:19+00:00,1509614260,"$ PEL easily reached a high of 498 % and became the 1 top gainer on Kucoin_CEX for almost an hour . However , we saw an unexpected influx of selling pressure and iceberg orders ( hidden orders by the coin team ) that prevented this pump from reaching our 2,000 % target . However , our whales were stronger and kept pushing the price as expected , holding PEL as the 1 top gainer again , and pulling in thousands of outside traders into our pump pushing us once again to new highs and allowing our members to book profits of at least an extra 400 % . Stay tuned for our next huge move !",175071,
5,380,2023-05-28 17:03:02+00:00,1509614260,3rd wave incoming ! ! Buy he dip and hold this gem for maximum profits ! !,27764,
5,379,2023-05-28 17:02:01+00:00,1509614260,"Hold on tight , we're about to go much higher ! !",30889,
5,378,2023-05-28 17:01:01+00:00,1509614260,2nd wave starting now ! !,25940,
2,377,2023-05-28 17:00:01+00:00,1509614260,The coin we are pumping today is : PEL Buy and hold for massive profits EXCHANGE: kucoin_CEX; TRADING PAIR: PEL-USDT.,171682,
1,376,2023-05-28 16:59:01+00:00,1509614260,"1 minute left , the next message will be the coin to buy !",129294,
1,375,2023-05-28 16:55:00+00:00,1509614260,"5 minutes left . The coin will be sent here before making twitter and the rest of the internet explode , be ready ! !",25361,
1,374,2023-05-28 16:50:02+00:00,1509614260,"10 minutes left . We expect out coin to be the Number 1 gainer on Kucoin_CEX for at least 24 hours , which means millions of outside traders around the world will keep buying and pushing the price higher",26739,
1,373,2023-05-28 16:30:01+00:00,1509614260,30 minutes left .,24736,
1,371,2023-05-28 16:01:13+00:00,1509614260,"1 hour remaining for the biggest Kucoin_CEX Mega Pump of all times ! ! We expect our biggest volume yet , as all our whales will be pushing and sustaining prices for hours . We're ready for a 3,000 % move ( at least ) , guaranteeing the maximum profits for all our members . Make sure to hold after market buying the token , as the second and third waves are always the strongest ( which could reach up to 4,000 % , 5,000 % or higher ) . Expect a powerful and long lasting pump today , be prepared This coin will ONLY be available on Kucoin_CEX and USDT Pair",141632,
1,370,2023-05-28 14:00:00+00:00,1509614260,"🟢 3 hours left until the Kucoin_CEX Mega Pump . This is a basic step-by-step-strategy for new members : 1 . Ten minutes before 17:00 PM GMT have Kucoin_CEX , Telegram open . 2 . At exactly 17:00 PM GMT , there will a message including the name of our coin in our Telegram channel . 3 . After the announcement , you already know what to do ( review our guide and tips ) . 🚨 Make sure to read our VIP guide on how to make the most profits from this pump : UNKNOWN_URL: telegra",24947,
1,369,2023-05-28 11:00:00+00:00,1509614260,"🟢 6 hours left ! ! IMPORTANT TIPS : - Our target will be very high profit today ( Aiming at a minimum 3,000 % + ) . We will be using the Kucoin_CEX exchange to pump . - We will be using the USDT pairing to buy , make sure you have USDT in your account to buy the coin . - Hundreds of thousands of traders will be buying at once , make sure you buy early before outsiders do . - If you plan to use your whole balance , you can buy using 75 % of your balance initially at market price , use the remaining of your balance to place buy orders ! - When you buy the coin and it's time to sell , never sell on the buy supports ! Instead sell slowly in parts as the price goes up . - Our pump will have many waves as our whales will actively be buying with our members to support the price , there will be a lot of possibilities to make profits many times during the pump ! - After buying , we highly suggest to place buy orders below the market price as the price moves up . - Millions of traders worldwide will be watching and buying , we have put into place a few measures to spread the word out after our signal all over social media , we will make sure our pump lasts and holds as long as possible , as always .",31628,
1,367,2023-05-27 17:00:00+00:00,1509614260,"🟢 24 hours left for our biggest Kucoin_CEX Mega Pump ever ! As we already told you , our old whales have joined forces with new and even bigger whales , who will be pushing price up for hours , with each wave being bigger than the previous one , giving all our members the chance to buy and hold for maximum profits ! We're aiming at a minimum of 3,000 % , so be ready ! !",30538,
1,366,2023-05-25 16:59:59+00:00,1509614260,"🟢 3 days left for the biggest pump in Kucoin_CEX history ! ! A group of the largest whales in crypto ( we're talking wallets holding over 1,000 BTC ) have joined our team for this Kucoin_CEX Mega Pump , and we're ready to send it higher than any other pump seen before ! !",25784,
1,365,2023-05-22 17:00:00+00:00,1509614260,"6 days left for our biggest Kucoin_CEX Mega Pump of all times , be ready ! !",26854,
0,363,2023-05-17 17:01:03+00:00,1509614260,"🛎 Pump Signal Announcement ! 🛎 Date : Sunday May 28 2023 Time : 17:00 pm GMT Exchange : KUCOIN_CEX Advantage : Free for all Once again all our members managed to make huge profits on our previous pump ( BIFI ) , which reached over 600 % with millions of dollars in volume over the first couple of hours , and with outside traders from all over the world entering after our members bought in . We had multiple waves to take profit , as our whales supported the pump and held prices up , but it's not even close to what we're expecting on our next Kucoin_CEX Mega Pump . This is what we've been working on behind the scenes for the past few weeks … we've found a Kucoin_CEX loophole for our next coin , which will allow it to go over 3,000 % , and will hold up for hours . We're also bringing in the biggest whales in the space with us , meaning we'll see the strongest and most profitable pump we've ever had . This Kucoin_CEX Mega Pump will take place on Sunday May 28 ( exactly 11 days from now ) , with a goal of no less than 3,000 % for all our members … Be ready for further announcements and don't forget to turn on your push notifications for our channel ! ! 🚀 🚀",28989,
3,76,2021-11-03 14:19:32+00:00,1509614260,"🚨 $ BRD UPDATE 🚨 = = = What a great pump everyone ! ! ! With a maximum profit of 69 % in a matter of minutes , you should have all made at least 40 % assuming you didn't nail the perfect top for this move … Our pump held for over 15 minutes above 40 % in profit , making each and every member amazing profits ! 🔥 🔥 🔥 We're the only ones in the market with high strength sustaining pumps , and this is just getting started … Be ready for further announcements 😉",100145,
5,74,2021-10-31 15:04:06+00:00,1509614260,"🚨 HOLDING FOR OUR THIRD WAVE 🚨 = = = We're expecting an even stronger third wave everyone ! ! Holding at least 50 % of coins for it and getting more outside traders into our pump . Our whales are still buying and pushing prices higher , let's send it to the moon ! ! 🔥 🔥",103305,
5,73,2021-10-31 15:02:06+00:00,1509614260,🚨 SECOND WAVE INCOMING 🚨 = = = Our whales are ready for our second wave ! ! They're already buying our coin to support price action and take it even higher than our first wave . Let's dot this everyone ! !,92979,
5,72,2021-10-31 15:01:06+00:00,1509614260,"🚨 BUY AND HOLD 🚨 = = = We're market buying with 75 % of our BTC and placing limit orders below market price with the remaining 25 % to support price and lure outside buyers into our pump . We're just getting starting with this pump , we're all holding to keep price up and lure outside investors into our pump ! !",90787,
5,71,2021-10-31 15:00:05+00:00,1509614260,"🚨 $ BRD CHARTING UPDATE 🚨 $ BRD is ready for a massive pump , and its chart cannot lie … With a 3,000 % + potential without any leverage and a humble final target bellow our long term highs , this gem is about to make us all rich . With a long term accumulation around 500 sats and our first significant resistance level at 2,426 sats , we can expect a minimum profit of 400-500 % in the short term . Enjoy the ride 🚀 🚀 🚀",88538,
5,70,2021-10-31 15:00:05+00:00,1509614260,"🚨 $ BRD / BTC 🚨 = = = 🚀 🚀 🚀 ( BTC paired , Binance_CEX ) Click on link to buy EXCHANGE: binance_CEX; TRADING PAIR: BRD-BTC. = = =",86021,
1,69,2021-10-31 14:59:06+00:00,1509614260,"🚨 1 MINUTE LEFT 🚨 = = = Keep our channel's screen open , NEXT POST IS OUR COIN 🚀 🚀 🚀",74504,
1,68,2021-10-31 14:58:06+00:00,1509614260,🚨 2 MINUTES LEFT 🚨,71432,
1,67,2021-10-31 14:55:05+00:00,1509614260,🚨 5 MINUTES LEFT 🚨,70373,
1,66,2021-10-31 14:45:08+00:00,1509614260,🚨 15 MINUTES LEFT 🚨 = = = Screens on and have BTC ready ! ! 🚀 🚀 🚀,70214,
1,65,2021-10-31 14:30:06+00:00,1509614260,🚨 30 MINUTES LEFT 🚨,68762,
1,64,2021-10-31 14:00:06+00:00,1509614260,🚨 1 HOUR LEFT 🚨 = = = 1 hour left ! ! Remember our pump instructions and remember the main objective of this pump : selling in great profit after luring outside traders into our pump !,69622,
1,63,2021-10-31 12:00:09+00:00,1509614260,"🚨 3 HOURS LEFT 🚨 = = = PUMP INSTRUCTIONS We already know what happens when we involve the biggest of whales in the market … price explodes to ridiculous highs and remains up , without dropping a penny , meaning we'll have buying support all throughout our pump . We recommend initially market buying 50-75 % of balance at market price to catch the first and strongest wave , then laddering the remaining BTC balance as limit orders below current market prices . We're expecting at least 3 initial waves to this pump , meaning we'll be market and limit buying and holding at different price points to get the best average entry When to sell ? In order to get the highest volume of outsider buying volume for this pump , do not sell into buying walls set by other members , instead sell small parts as price goes . Up and place limit orders above 150 % - 200 % The main objective of this pump is for all Big Pumps Binance_CEX members to make a huge profit , meaning we need to hold price up while outside traders enter the market . Our whales will be taking care of continuously pushing price up by market buying until we get the most outside buyers in 🐋 🐋",73019,
1,62,2021-10-31 09:00:06+00:00,1509614260,"🚨 6 HOURS LEFT 🚨 = = = To guarantee the most profit to all our members , our coin will be BTC Paired only on Binance_CEX , so transfer funds to Binance_CEX and convert to BTC in order to participate ! !",68560,
1,61,2021-10-31 03:00:06+00:00,1509614260,"🚨 12 HOURS LEFT 🚨 = = = 12 Hours left for the greatest pump we've seen on Binance_CEX , transfer funds to your Binance_CEX accounts and make sure notifications for this channel are turned on ! !",70879,
1,60,2021-10-30 15:00:06+00:00,1509614260,"🚨 24 HOURS LEFT 🚨 = = = 📆 DATE : Sunday October 31 , 2021 🕛 TIME : 15:00 GMT 🔶 EXCHANGE : Binance_CEX 1 day left ! ! Exactly 24 hours left before one of the most violent Binance_CEX pumps ever . We're working non-stop to make this pump known in every single coring of the world , people who will be entering after you've bought the coin to push it even higher . This is why our pumps are so profitable 😉",76326,
1,59,2021-10-28 15:00:06+00:00,1509614260,"🚨 3 DAYS LEFT 🚨 = = = You probably know it already , and you've probably seen it all around by now … We've got only 72 hours left for one of the biggest pumps we've ever seen on Binance_CEX . Everyone else is getting the coin after you are , and this is why we're making sure each and every member of our channel makes a killing our of it 🔥 🔥",82367,
1,58,2021-10-25 15:00:06+00:00,1509614260,"🚨 6 DAYS LEFT 🚨 = = = 📆 DATE : Sunday October 31 , 2021 🕛 TIME : 15:00 GMT 🔶 EXCHANGE : Binance_CEX Less than a week left for one of the biggest pumps Binance_CEX has ever seen . You know what happens with our coins , which have over and over made everyone here profits of 50 % - 80 % - 150 % and higher … This is no exception , so be ready for further announcements 😉",99104,
0,56,2021-10-17 13:25:57+00:00,1509614260,"🚨 PUMP ANNOUNCEMENT 🚨 = = = 📆 DATE : Sunday October 31 , 2021 🕛 TIME : 15:00 GMT 🔶 EXCHANGE : Binance_CEX BRD exploded 110 % , NEBL did 93 % , WABI 85 % … and the list goes on . We're now the largest pump network in the world , and our pumps are the only ones that manage to hold their gains long enough for everyone to make incredible profits . Why ? Because our strategy is unique , and it has proven so over and over again . First of all , we have absolutely 0 pre-buying . Second , we buy and hold , waiting for price to climb higher and outside traders to enter our coin before starting to sell . And third ( the most important of all ) , we have the biggest whales in the market with us in every pump , gradually buying into sell walls and creating several pump waves and holding price up to lure outsiders . And just as we promised … we now have something special for you . A pump so perfectly executed that the least amount of profit you can expect is 170-200 % . Be ready for it , we're only 14 days away . 🚀 🚀 🚀",122515,

