label,id,date,channel_id,message,views,image
3,367,2024-03-21 17:23:38+00:00,1575438613,"Here is our last pump result , reaching a high of 806 % in the first 30 minutes and racking $ 10 Million in total Volume , which made it the Top 1 gainer on Kucoin_CEX for hours and scored huge profits for all our members . With the market starting it's next leg up to new all time highs , with the biggest whales in our team and millions of new traders ready , we expect tomorrow's signal to be at least 2x as strong . The real power of the strongest whales in the market will be seen in this pump , and it will break above 1,000 % , so hold on tight .",493,
1,366,2024-03-21 17:00:06+00:00,1575438613,"24 hours left for our Kucoin_CEX Mega Pump ! ! Our marketing efforts over the past month will guarantee the maximum number of participants and the biggest volume in this pump , reaching over a million new traders from every corner of the world , and a volume of 10 + million $ in the first hours . We'll be constantly pushing the price higher , not likely seeing many retracements , prompting exponential growth . Buying and holding as soon as the signal is announced will be the most profitable strategy . Our goal in this pump is to guarantee all our members the biggest profits possible , aiming at a minimum of 1,000 % + We've had several weeks to grow our community to a size never seen before , and tomorrow's pump will be a clear display of our strength . We fully expect it to be the most powerful pump we have ever done !",564,
1,365,2024-03-20 17:00:07+00:00,1575438613,"2 days left ! ! Exactly 48 hours left for the biggest Kucoin_CEX Mega Pump we've ever seen ! ! Our goal is for all our members to make huge profits from this pump , with a minimum of 1,000 % ( and likely reaching much higher than 1,200 % with the power of our whales )",555,
1,364,2024-03-15 17:03:29+00:00,1575438613,7 days left ! ! Exactly 1 week left for the biggest and highest volume pump we've EVER had !,769,
0,363,2024-03-13 17:00:52+00:00,1575438613,"🛎 Pump Signal Announcement ! 🛎 Date : FRIDAY March 22 , 2024 Time : 17:00 pm GMT Exchange : KUCOIN_CEX Advantage : Free for all With the massive success of our previous pumps ( reaching peak targets of 800-1500 % , and averaging volumes of tens of millions of $ ) , which made huge profits for all our members , with a team stronger than ever and with the Bull Market at new all time highs , we're ready to announce our next KUCOIN_CEX Mega Pump , which will be by all standards the strongest we've ever had ! We've been meticulously planning this pump we've 2x our massive and global marketing campaign , which means we're going to see over a million new traders ( and the biggest whales ) joining this pump . We expect it to reach a high of no less than 800 % . This is a minimum , as the bull market could take this pump to a peak of well over 1,000- 1,200 % . This KUCOIN_CEX Mega Pump will have the largest volume ever recorded ( at least twice the volume of any other previous pumps ) , this means that all our members will be guaranteed the first entries , and the biggest profits … Our main goal for this pump will be to once again bring the most outside traders into our pump , which will push us up to our 800 % target and higher . Our elite team of whales will be supporting the pump for hours after our signal , which will guarantee the biggest profits for all our members . We have exactly 9 days to prepare for this massive pump , which will take place on FRIDAY March 22 , at 17:00 GMT . We expect millions of traders worldwide to participate in this pump , and we will make all social media platforms explode after our signal , which will get us to our 800 % target ( and very likely higher ) . Be ready for further announcements and don't forget to turn on push notifications for our channel ! !",925,
3,225,2023-12-03 18:02:54+00:00,1575438613,"Pump Result : Great pump with over $ 1.2 Million in trading volume in the first few minutes , which effortlessly pushed $ SUIA to a stunning 384 % high , and held it above 140 % for over an hours . Even though this pump would be considered “ amazing ” and honestly unattainable by other players in the market , to us it was just average , and we're ready to once again surpass all your expectations on our next pump . We're still receiving a flood of gratitude messages from all the members who made it big this time , and asking about our next Kucoin_CEX Mega Pump . No stress , enjoy the profits … we'll let you know sooner than you expect . Our community has grown by over 50,000 members over the past month , and this is just the tip of the iceberg , we have been working on something behind the scenes which will increase our pump strength by 2x - 3x or even more next time . Our focus remains on 1,000 % + , which unfortunately wasn't achieved this time due to a huge amount of external hidden sell orders and pressure , presumably from the coin team . Now we know how to address this small issue . Stay tuned for our next pump announcement .",11344,
3,224,2023-12-03 17:36:51+00:00,1575438613,Our whales holding SUIA above 140 % ! ! Making sure all our members make huge profits again ! ! 🔥 🚀 🚀,18815,
5,223,2023-12-03 17:05:08+00:00,1575438613,We're going higher ! !,9267,
5,222,2023-12-03 17:04:09+00:00,1575438613,3rd wave incoming ! ! Buy he dip and hold this gem for maximum profits ! !,7868,
5,221,2023-12-03 17:03:09+00:00,1575438613,"The target is 1,200 % ! !",9104,
5,220,2023-12-03 17:01:47+00:00,1575438613,"Hold on tight , we're about to go much higher ! !",8090,
5,219,2023-12-03 17:01:45+00:00,1575438613,"2nd wave starting now , buying every small dip before reaching new highs ! !",8217,
2,218,2023-12-03 17:00:06+00:00,1575438613,The coin we are pumping today is : SUIA Buy and hold for massive profits EXCHANGE: kucoin_CEX; TRADING PAIR: SUIA-USDT.,8602,
1,217,2023-12-03 16:59:09+00:00,1575438613,"1 minute left , the next message will be the coin to buy !",8546,
1,216,2023-12-03 16:55:08+00:00,1575438613,"5 minutes left . We have twitter and all other social media platforms ready to explode after our signal , keep your screens open ! Our whales are ready and active ! !",7726,
1,215,2023-12-03 16:50:08+00:00,1575438613,"10 minutes left . Millions of outside traders around the world will keep buying and pushing the price higher , we'll be holding to our 1,200 % + target",8231,
1,214,2023-12-03 16:30:18+00:00,1575438613,"30 minutes left . This pump will be executed in 3 different waves , the first one will be the signal sent here , and the other 2 will be signals sent afterwards to other social media channels . This pump will most likely be the strongest we've had , easily reaching above 1,200 % . You will receive the signal before anyone else",8442,
1,213,2023-12-03 16:00:10+00:00,1575438613,"1 hour remaining for our biggest Kucoin_CEX Mega Pump ! ! BTC pumping hard , making the market extremely bullish . We expect the biggest volume yet , as all our whales will be constantly buying and pushing towards new highs . We're ready for an EASY 1,200 - 1,500 % move ( at least ) , guaranteeing the maximum profits for all our members . Make sure to hold after market buying , as the second and third waves are always the strongest ( which could reach up to 1,500 % or higher ) . Expect an extremely powerful and long lasting pump today , be prepared ! IMPORTANT : This coin will ONLY be available on KUCOIN_CEX and on USDT pair , get ready for huge profits !",8498,
1,212,2023-12-03 14:00:08+00:00,1575438613,"3 hours left until the Kucoin_CEX Mega Pump . This is a basic step-by-step-strategy for new members : 1 . Ten minutes before 17:00 PM GMT have Kucoin_CEX , Telegram open . 2 . At exactly 17:00 PM GMT , there will a message including the name of our coin in our Telegram channel . 3 . After the announcement , you already know what to do ( review our guide and tips ) .",8514,
1,211,2023-12-03 11:00:13+00:00,1575438613,"6 hours left ! ! IMPORTANT TIPS : - Our target will be very high profit today ( Aiming at a minimum 1,200 % -1,500 % ) . We will be using the Kucoin_CEX exchange to pump . - We will be using the USDT pairing to buy , make sure you have USDT in your account to buy the coin . - Hundreds of thousands of traders will be buying at once , make sure you buy early before outsiders do . - If you plan to use your whole balance , you can buy using 75 % of your balance initially at market price , use the remaining of your balance to place buy orders ! - When you buy the coin and it's time to sell , never sell on the buy supports ! Instead sell slowly in parts as the price goes up . - Our pump will have many waves as our whales will actively be buying with our members to support the price , there will be a lot of possibilities to make profits many times during the pump ! - After buying , we highly suggest to place buy orders below the market price as the price moves up . - Millions of traders worldwide will be watching and buying , we have put into place a few measures to spread the word out after our signal all over social media , we will make sure our pump lasts and holds as long as possible , as always .",7805,
1,210,2023-12-03 05:00:08+00:00,1575438613,"12 Hours Left ! ! This is the first pump of the month , and for a good reason … we've been preparing for it meticulously , and expect no less than 15x ( 1,500 % ) .",9481,
5,209,2023-12-02 19:25:03+00:00,1575438613,"BTC approaching $ 40k and ETH just broke above 2 - year highs . The Bull Market is here again ladies and gentlemen , which means tomorrow's pump will be the biggest one we've ever seen , we will get the highest volume recorded in years , and we'll make sure all our members score insane profits . The signal will be sent here first , before being sent to other social media platforms , which will take us to our 1,200 % target as a first stop , and we're extremely confident we'll go even higher . Warm your engined . Stay tuned .",14630,
3,208,2023-12-02 17:19:54+00:00,1575438613,"Just a small example of our whale's strength on our previous Kucoin_CEX Mega Pump , which reached a peak of 469 % with millions of $ in volume . We expect today's signal to be twice as strong . Hold on tight .",8598,
1,207,2023-12-02 17:01:33+00:00,1575438613,"24 hours left for our Kucoin_CEX Mega Pump ! ! Our marketing efforts over the past month will guarantee the maximum number of participants and the biggest volume in this pump , reaching millions of traders from every corner of the world , and a volume of tens of millions of $ in the first hours . We'll be constantly pushing the price higher , not likely seeing many retracements . Buying and holding as soon as the signal is announced will be the most profitable strategy . Our goal in this pump is to guarantee all our members the biggest profits possible , aiming at a minimum of 800 % + IMPORTANT : If not yet done , verify your Kucoin_CEX account for trading , read the guide below : UNKNOWN_URL: telegra",8794,
1,206,2023-12-01 17:00:10+00:00,1575438613,"2 days left ! ! Exactly 48 hours left for the biggest Kucoin_CEX Mega Pump we've ever seen ! ! Our goal is for all our members to make huge profits from this pump , our goal is a minimum of 1,200 % ( and like reaching much higher than 1,500 % with the power of our whales )",12380,
1,205,2023-11-30 17:00:13+00:00,1575438613,"3 days left for our massive Kucoin_CEX Mega Pump . We've chosen SUNDAY October 15 because market conditions are perfect and we're ready to make all our members profits of at least 1,200- 1,500 % ( which is the bare minimum and will likely explode even higher ) . To guarantee this , we have the biggest whales in the market onboard this pump with us , and we'll make sure there is absolutely no pre-buying and no pre-pump . Make sure to read our VIP guide on how to make the most profits from this Kucoin_CEX Mega Pump : UNKNOWN_URL: telegra",12337,
1,204,2023-11-29 17:44:23+00:00,1575438613,4 days left ! ! For the biggest and highest volume pump we've EVER had !,12421,
0,202,2023-11-24 22:16:06+00:00,1575438613,"🛎 Pump Signal Announcement ! 🛎 Date : SUNDAY December 3 , 2023 Time : 17:00 pm GMT Exchange : KUCOIN_CEX Advantage : Free for all With the massive success of our previous pumps ( reaching peaks of 700-1 , 500 % ) , a team stronger than ever , and the next alt-season just around the corner , we're ready to announce the biggest Kucoin_CEX Mega pump we've ever had . We've put together a massive and global marketing campaign over the past month , which means we're going to see over 100,000 traders joining our next pump , which is expected to reach a high of no less than 1,500 % . We're about to bag have the biggest volume we've ever witnessed , and that's exactly why we decided to pump on KUCOIN_CEX . This means that all are members will be guaranteed the first entries … Our main goal for this pump will be to once again bring the most outside traders into our pump , which will push us up to our 1,500 % target . Our elite team of whales will be supporting the pump for hours after our signal , which will guarantee the biggest profits for all our members . We have exactly 8 days to prepare for this massive pump , which will take place on SUNDAY December 3 , at 17:00 GMT . We expect millions of traders worldwide to participate in this pump , and we'll make all social media platforms explode after our signal , which will get us to our 1,500 % target ( or higher ) . Be ready for further announcements and don't forget to turn on push notifications for our channel ! !",14075,
3,103,2023-07-27 18:00:01+00:00,1575438613,"Pump Results : The amount of volume generated in the first few minutes ( over 1.5 million $ ) was more than enough to push this coin up over 1,000 % . Unfortunately , we ran into an “ iceberg ” coin , which means this particular coin had an unlimited number of regenerating sell orders , preventing us from executing a decent pump . We only reached a high of 130 % , which is still respectable , but not up to our standards , specially for the huge volume achieved . Our team has tried to keep the price up but was unsuccessful due to the nature of this coin . We picked it due to the bullish momentum it was gaining on the daily chart on relatively low volume , which would have maximized the number of outside traders entering the pump , pushing us much higher than 1,000 % but it ended up backfiring on us as the coin was also detected by bots , which pre bought and dumped on us . Our team had the pure intention of pushing the price of this coin at least 1,000 % for all our members but unfortunately it was impossible on this coin . In our next pump , we will make sure to pick a coin that we know can be pumped to over 1,000 % , having all the factors we discussed in account . Our team of whales will make sure that we reach our target and higher by injecting a massive amount of volume during the pump , after our members have bought in . We will make sure to choose a coin that follows all our criteria for a massive pump , a type of coin we've already had experience with , to guarantee the biggest profits for all our members , without facing any issues . Stay tuned for further announcements !",10006,
5,102,2023-07-27 17:04:07+00:00,1575438613,We're going higher ! !,10715,
5,101,2023-07-27 17:03:07+00:00,1575438613,3rd wave incoming ! ! Buy he dip and hold this gem for maximum profits ! !,10943,
5,100,2023-07-27 17:02:35+00:00,1575438613,"2nd wave starting now , buying every small dip before reaching new highs ! !",10771,
5,99,2023-07-27 17:02:06+00:00,1575438613,"Hold on tight , we're about to go much higher ! !",10465,
2,98,2023-07-27 17:00:06+00:00,1575438613,The coin we are pumping today is : PEEL Buy and hold for massive profits EXCHANGE: kucoin_CEX; TRADING PAIR: PEEL-USDT.,10349,
1,97,2023-07-27 16:59:06+00:00,1575438613,"1 minute left , the next message will be the coin to buy !",16889,
1,96,2023-07-27 16:55:05+00:00,1575438613,"5 minutes left . We have twitter and all other social media platforms ready to explode after our signal , keep your screens open !",9219,
1,95,2023-07-27 16:52:14+00:00,1575438613,"10 minutes left . We expect our coin to be the Number 1 Top Gainer on Kucoin_CEX for at least 24 hours , which means millions of outside traders around the world will keep buying and pushing the price higher , we'll be holding to our 800 % + target",11001,
1,94,2023-07-27 16:30:07+00:00,1575438613,30 minutes left .,9213,
1,93,2023-07-27 16:00:06+00:00,1575438613,"1 hour remaining for our biggest Kucoin_CEX Mega Pump ! ! We expect the biggest volume yet , as all our whales will be constantly buying and pushing towards new highs . We're ready for a 500 - 1,500 % move ( at least ) , guaranteeing the maximum profits for all our members . Make sure to hold after market buying , as the second and third waves are always the strongest ( which could reach up to 1,500 % or higher ) . Expect an extremely powerful and long lasting pump today , be prepared ! IMPORTANT : This coin will ONLY be available on KUCOIN_CEX and on USDT pair , get ready for huge profits !",11759,
1,92,2023-07-27 14:00:47+00:00,1575438613,"3 hours left until the Kucoin_CEX Mega Pump . This is a basic step-by-step-strategy for new members : 1 . Ten minutes before 17:00 PM GMT have Kucoin_CEX , Telegram open . 2 . At exactly 17:00 PM GMT , there will a message including the name of our coin in our Telegram channel . 3 . After the announcement , you already know what to do ( review our guide and tips ) . IMPORTANT : If not yet done , verify your Kucoin_CEX account for trading , read the guide below : UNKNOWN_URL: telegra",10156,
1,91,2023-07-27 11:00:27+00:00,1575438613,"6 hours left ! ! IMPORTANT TIPS : - Our target will be very high profit today ( Aiming at a minimum 500 % -1,500 % ) . We will be using the Kucoin_CEX exchange to pump . - We will be using the USDT pairing to buy , make sure you have USDT in your account to buy the coin . - Hundreds of thousands of traders will be buying at once , make sure you buy early before outsiders do . - If you plan to use your whole balance , you can buy using 75 % of your balance initially at market price , use the remaining of your balance to place buy orders ! - When you buy the coin and it's time to sell , never sell on the buy supports ! Instead sell slowly in parts as the price goes up . - Our pump will have many waves as our whales will actively be buying with our members to support the price , there will be a lot of possibilities to make profits many times during the pump ! - After buying , we highly suggest to place buy orders below the market price as the price moves up . - Millions of traders worldwide will be watching and buying , we have put into place a few measures to spread the word out after our signal all over social media , we will make sure our pump lasts and holds as long as possible , as always .",10863,
1,90,2023-07-27 05:01:12+00:00,1575438613,12 Hours Left ! !,10038,
3,89,2023-07-26 17:10:20+00:00,1575438613,"An example of our last pump , which reached a high of 431 % , and we expect tomorrows signal to be at least 2x as strong . The real power of the strongest whales in the market will be seen in this pump , hold on tight .",9487,
1,88,2023-07-26 17:00:38+00:00,1575438613,"24 hours left for our Kucoin_CEX Mega Pump ! ! We expect the maximum number of participants and the biggest volume in this pump , reaching millions of traders from every corner of the world , and a volume of tens of millions of $ in the first hours . We'll be constantly pushing the price higher , not likely seeing many retracements . Buying and holding as soon as the signal is announced will be the most profitable strategy . Our goal in this pump is to guarantee all our members the biggest profits possible , aiming at a minimum of 800 % +",9243,
1,86,2023-07-25 17:00:20+00:00,1575438613,"2 days left ! ! Exactly 48 hours left for the biggest Kucoin_CEX Mega Pump we've ever seen . Exactly 48 hours left for our biggest Kucoin_CEX pump signal in history ! ! Our goal is for all our members to make huge profits from this pump , our goal is a minimum of 700 % ( and like reaching much higher than 1,200 % - 1,400 % with the power of our whales )",9645,
1,85,2023-07-24 17:00:07+00:00,1575438613,"3 days left for our massive Kucoin_CEX Mega Pump . We've chosen Thursday July 27 because market conditions are perfect and we're ready to make all our members profits of at least 500-800 % ( which is the bare minimum and will likely explode even higher ) . To guarantee this , we have the biggest whales the market onboard this pump with us , and we'll make sure there is absolutely no pre-buying and no pre-pump . Make sure to read our VIP guide on how to make the most profits from this Kucoin_CEX Mega Pump : UNKNOWN_URL: telegra",9623,
0,84,2023-07-21 17:44:47+00:00,1575438613,"🛎 Pump Signal Announcement ! 🛎 Date : THURSDAY July 27 , 2023 Time : 17:00 pm GMT Exchange : KUCOIN_CEX Advantage : Free for all With the massive success of our previous signals ( reaching peaks of 500-1 , 500 % ) and a huge incoming alt season , we're ready to announce our next huge pump on KUCOIN_CEX . With our new team of whales , which is by far the strongest in the market , we're ready to see our biggest volume in history ( averaging tens of millions $ ) , making all our members profits of AT LEAST 500-800 % . That's exactly why we decided to pump on KUCOIN_CEX , and why this pump will be the biggest we've ever seen . Our main goal for this pump will be to once again bring the most outside traders into our pump after all our members buy in first , which will push us up to out 1,500 % target . Our elite team of whales will be supporting the pump for hours after our signal , which will guarantee the biggest profits for all our members . We have exactly 6 days to prepare for this massive pump , which will take place on THURSDAY July 27 , at 17:00 GMT . We expect millions of traders worldwide to participate in this pump , and making all social media platforms explode after our signal , which will get us to our 1,500 % target ( or higher ) . Be ready for further announcements and don't forget to turn on push notifications for our channel ! !",9630,
